### DISCUSSION TITLE
Nous A1 web energy update reloads from wrong device

### DISCUSSION THREAD

**Discussion by joba-1** [arendst/Tasmota#16725] [Q&A]
### PROBLEM DESCRIPTION
A power plug with latest tasmota dev (and older versions) does energy sensor updates on the main web page from a wrong IP.
In my case it partially loads the menu of a shelly 2.5 (which runs original shelly firmware)

### REQUESTED INFORMATION

- [x] Read the [Contributing Guide and Policy](https://github.com/arendst/Tasmota/blob/development/CONTRIBUTING.md) and [the Code of Conduct](https://github.com/arendst/Tasmota/blob/development/CODE_OF_CONDUCT.md)
- [x] Searched the problem in [issues](https://github.com/arendst/Tasmota/issues)
- [ ] Searched the problem in [discussions](https://github.com/arendst/Tasmota/discussions)
- [ ] Searched the problem in the [docs](https://tasmota.github.io/docs/FAQ)
- [ ] Searched the problem in the [chat](https://discord.gg/Ks2Kzd4)
- [x] Device used (e.g., Sonoff Basic): Nous A1
- [x] Tasmota binary firmware version number used: Tasmota 12.1.1.4
  - [x] Pre-compiled
  - [ ] Self-compiled
- [x] Flashing tools used: OTA
- [ ] Provide the output of command: `Backlog Template; Module; GPIO 255`:
```lua
  Configuration output here:
15:13:52.194 CMD: Backlog Template; Module; GPIO 255
15:13:52.242 MQT: stat/nous3/RESULT = {"NAME":"NOUS A1","GPIO":[320,0,576,0,2656,2720,0,0,2624,32,0,224,0,0],"FLAG":0,"BASE":45}
15:13:52.454 MQT: stat/nous3/RESULT = {"Module":{"0":"NOUS A1"}}
15:13:52.709 MQT: stat/nous3/RESULT = {"GPIO0":{"320":"Led_i1"},"GPIO1":{"0":"None"},"GPIO2":{"576":"LedLink_i"},"GPIO3":{"0":"None"},"GPIO4":{"2656":"HLWBL CF1"},"GPIO5":{"2720":"BL0937 CF"},"GPIO9":{"0":"None"},"GPIO10":{"0":"None"},"GPIO12":{"2624":"HLWBL SEL_i"},"GPIO13":{"32":"Button1"},"GPIO14":{"0":"None"},"GPIO15":{"224":"Relay1"},"GPIO16":{"0":"None"},"GPIO17":{"0":"None"}}

```
- [ ] If using rules, provide the output of this command: `Backlog Rule1; Rule2; Rule3`:
```lua
  Rules output here:


```
- [ ] Provide the output of this command: `Status 0`:
```lua
  STATUS 0 output here:
15:14:23.345 CMD: status 0
15:14:23.353 MQT: stat/nous3/STATUS = {"Status":{"Module":0,"DeviceName":"PV Lüfter","FriendlyName":["PV Lüfter"],"Topic":"nous3","ButtonTopic":"0","Power":1,"PowerOnState":3,"LedState":1,"LedMask":"FFFF","SaveData":1,"SaveState":1,"SwitchTopic":"0","SwitchMode":[0,0,0,0,0,0,0,0],"ButtonRetain":0,"SwitchRetain":0,"SensorRetain":0,"PowerRetain":0,"InfoRetain":0,"StateRetain":0,"StatusRetain":0}}
15:14:23.385 MQT: stat/nous3/STATUS1 = {"StatusPRM":{"Baudrate":115200,"SerialConfig":"8N1","GroupTopic":"tasmotas","OtaUrl":"http://ota.tasmota.com/tasmota/tasmota.bin.gz","RestartReason":"Software/System restart","Uptime":"0T00:06:05","StartupUTC":"2022-10-04T14:08:18","Sleep":50,"CfgHolder":4617,"BootCount":23,"BCResetTime":"2021-11-26T01:27:53","SaveCount":809,"SaveAddress":"FA000"}}
15:14:23.421 MQT: stat/nous3/STATUS2 = {"StatusFWR":{"Version":"12.1.1.4(tasmota)","BuildDateTime":"2022-10-04T11:30:50","Boot":31,"Core":"2_7_4_9","SDK":"2.2.2-dev(38a443e)","CpuFrequency":80,"Hardware":"ESP8285","CR":"358/699"}}
15:14:23.438 MQT: stat/nous3/STATUS3 = {"StatusLOG":{"SerialLog":2,"WebLog":2,"MqttLog":0,"SysLog":2,"LogHost":"job4","LogPort":514,"SSId":["job.fritz.ssid","job.iot.ssid"],"TelePeriod":60,"Resolution":"558180C0","SetOption":["0000A009","2805C80001000600003C5A0A002800000000","00000080","00006000","00004000","00000000"]}}
15:14:23.473 MQT: stat/nous3/STATUS4 = {"StatusMEM":{"ProgramSize":626,"Free":376,"Heap":23,"ProgramFlashSize":1024,"FlashSize":1024,"FlashChipId":"144051","FlashFrequency":40,"FlashMode":"DOUT","Features":["00000809","8F9AC787","04368001","000000CF","010013C0","C000F981","00004004","00001000","54000020","00000000"],"Drivers":"1,2,3,4,5,6,7,8,9,10,12,16,18,19,20,21,22,24,26,27,29,30,35,37,45,62","Sensors":"1,2,3,4,5,6"}}
15:14:23.508 MQT: stat/nous3/STATUS5 = {"StatusNET":{"Hostname":"nous3","IPAddress":"192.168.1.144","Gateway":"192.168.1.221","Subnetmask":"255.255.255.0","DNSServer1":"192.168.1.236","DNSServer2":"0.0.0.0","Mac":"C4:4F:33:F7:B3:8F","Webserver":2,"HTTP_API":1,"WifiConfig":4,"WifiPower":17.0}}
15:14:23.531 MQT: stat/nous3/STATUS6 = {"StatusMQT":{"MqttHost":"job4","MqttPort":1883,"MqttClientMask":"DVES_%06X","MqttClient":"DVES_F7B38F","MqttUser":"DVES_USER","MqttCount":1,"MAX_PACKET_SIZE":1200,"KEEPALIVE":30,"SOCKET_TIMEOUT":4}}
15:14:23.554 MQT: stat/nous3/STATUS7 = {"StatusTIM":{"UTC":"2022-10-04T14:14:23","Local":"2022-10-04T15:14:23","StartDST":"2022-03-27T02:00:00","EndDST":"2022-10-30T03:00:00","Timezone":"+01:00","Sunrise":"06:54","Sunset":"18:23"}}
15:14:23.571 MQT: stat/nous3/STATUS9 = {"StatusPTH":{"PowerDelta":[0,0,0],"PowerLow":0,"PowerHigh":0,"VoltageLow":0,"VoltageHigh":0,"CurrentLow":0,"CurrentHigh":0}}
15:14:23.591 MQT: stat/nous3/STATUS10 = {"StatusSNS":{"Time":"2022-10-04T15:14:23","ENERGY":{"TotalStartTime":"2021-11-26T01:27:53","Total":8.634,"Yesterday":0.007,"Today":0.001,"Power":1,"ApparentPower":8,"ReactivePower":8,"Factor":0.08,"Voltage":237,"Current":0.035}}}
15:14:23.614 MQT: stat/nous3/STATUS11 = {"StatusSTS":{"Time":"2022-10-04T15:14:23","Uptime":"0T00:06:05","UptimeSec":365,"Heap":23,"SleepMode":"Dynamic","Sleep":50,"LoadAvg":19,"MqttCount":1,"POWER":"ON","Wifi":{"AP":1,"SSId":"job.fritz.ssid","BSSId":"28:D1:27:4E:6B:9D","Channel":9,"Mode":"11n","RSSI":64,"Signal":-68,"LinkCount":1,"Downtime":"0T00:00:05"}}}


```
- [ ] Set `weblog` to 4 and then, when you experience your issue, provide the output of the Console log:
```lua
  Console output here:
15:15:13.332 CMD: weblog 4
15:15:13.338 MQT: stat/nous3/RESULT = {"WebLog":4}
15:15:13.868 CFG: Saved to flash at F9, Count 810, Bytes 4096
15:15:14.201 HLW: EPC 1, CFlen 1308651 usec
15:15:15.201 HLW: EPC 1, CFlen 1140559 usec
15:15:17.201 HLW: EPC 1, CFlen 1965776 usec
15:15:18.200 HLW: EPC 1, CFlen 830221 usec
15:15:19.200 HLW: EPC 1, CFlen 1528920 usec
15:15:19.438 WIF: Sending Gratuitous ARP
15:15:20.200 HLW: EPC 1, CFlen 1397410 usec
15:15:21.200 HLW: EPC 1, CFlen 972463 usec
15:15:21.395 HTP: Main Menu
15:15:23.200 HLW: EPC 1, CFlen 1180218 usec
15:15:24.014 WIF: Checking connection...
15:15:24.200 HLW: EPC 1, CFlen 1536215 usec
15:15:26.200 HLW: EPC 1, CFlen 1351052 usec
15:15:27.200 HLW: EPC 1, CFlen 1514457 usec
15:15:29.200 HLW: EPC 1, CFlen 1731386 usec
15:15:29.471 MQT: tele/nous3/STATE = {"Time":"2022-10-04T15:15:29","Uptime":"0T00:07:11","UptimeSec":431,"Heap":25,"SleepMode":"Dynamic","Sleep":50,"LoadAvg":19,"MqttCount":1,"POWER":"ON","Wifi":{"AP":1,"SSId":"job.fritz.ssid","BSSId":"28:D1:27:4E:6B:9D","Channel":9,"Mode":"11n","RSSI":64,"Signal":-68,"LinkCount":1,"Downtime":"0T00:00:05"}}
15:15:29.502 MQT: tele/nous3/SENSOR = {"Time":"2022-10-04T15:15:29","ENERGY":{"TotalStartTime":"2021-11-26T01:27:53","Total":8.634,"Yesterday":0.007,"Today":0.001,"Period":0,"Power":1,"ApparentPower":6,"ReactivePower":6,"Factor":0.09,"Voltage":237,"Current":0.027}}
15:15:30.200 HLW: EPC 1, CFlen 1360795 usec
15:15:32.200 HLW: EPC 1, CFlen 1892209 usec
15:15:33.200 HLW: EPC 1, CFlen 1034310 usec
15:15:34.200 HLW: EPC 1, CFlen 1116747 usec
15:15:36.200 HLW: EPC 1, CFlen 1719576 usec
15:15:37.200 HLW: EPC 1, CFlen 1177258 usec
15:15:38.201 HLW: EPC 1, CFlen 1087178 usec
15:15:39.200 HLW: EPC 1, CFlen 1320052 usec
15:15:41.200 HLW: EPC 1, CFlen 1120310 usec
15:15:42.200 HLW: EPC 1, CFlen 1070686 usec
15:15:43.200 HLW: EPC 1, CFlen 1737428 usec
15:15:44.032 WIF: Checking connection...
15:15:45.200 HLW: EPC 1, CFlen 1654532 usec
15:15:47.200 HLW: EPC 1, CFlen 1482886 usec
15:15:49.200 HLW: EPC 1, CFlen 2110087 usec

```

### TO REPRODUCE
just open main web page and wait for one sensor update

### EXPECTED BEHAVIOUR
Update sensor values

### SCREENSHOTS
![image](https://user-images.githubusercontent.com/32450554/193844280-a79c3a40-23e7-459d-aa66-ee7cf510d810.png)

### ADDITIONAL CONTEXT
Ip of tasmota device is next to shelly:

```
job4:~ > ping -c3 nous3
PING nous3.job (192.168.1.144) 56(84) bytes of data.
64 bytes from nous3.job (192.168.1.144): icmp_seq=1 ttl=255 time=3.95 ms
64 bytes from nous3.job (192.168.1.144): icmp_seq=2 ttl=255 time=43.3 ms
64 bytes from nous3.job (192.168.1.144): icmp_seq=3 ttl=255 time=3.56 ms

--- nous3.job ping statistics ---
3 packets transmitted, 3 received, 0% packet loss, time 2001ms
rtt min/avg/max/mdev = 3.566/16.952/43.340/18.659 ms


job4:~ > ping -c3 shellyswitch25-0083A7
PING shellyswitch25-0083A7.job (192.168.1.143) 56(84) bytes of data.
64 bytes from shellyswitch25-0083A7.job (192.168.1.143): icmp_seq=1 ttl=128 time=65.8 ms
64 bytes from shellyswitch25-0083A7.job (192.168.1.143): icmp_seq=2 ttl=128 time=88.6 ms
64 bytes from shellyswitch25-0083A7.job (192.168.1.143): icmp_seq=3 ttl=128 time=1.73 ms

--- shellyswitch25-0083A7.job ping statistics ---
3 packets transmitted, 3 received, 0% packet loss, time 2002ms
rtt min/avg/max/mdev = 1.731/52.077/88.699/36.806 ms

```

both devices get IP config from same DHCP server (an openwrt router)

**(Please, remember to close the issue when the problem has been addressed)**

**Comment by arendst** [comment]
I see no reason to expect a Tasmota issue here.

As can be seen from your screenshot the browser requests ``nous3/?`` and resolves the wrong address. No tasmota involved here. Check your ARP tables.

**Comment by joba-1** [comment]
The strange thing for me is that the main page is always displayed correctly -> resolve ok.
Then comes the sensor values update (which is ajax?) and that resolves wrong every time.
If I reload the page a second later it resolves fine. Doesn't sound plausible to me that arp tables switch back and forth all the time. But I will check.

I have other nous with the same version and no problem there. So that indicates a non-tasmota network problem. 

Maybe some combination.

**Comment by Jason2866** [comment]
I would do a `reset 1` and configure the device(s) from scratch.

**Comment by joba-1** [comment]
ok, before I do that:

Net looks like this: browser (IP *.4) via ethernet to router. Router has 2 wlan ssids: one with shelly (IP *.143) and one with nous (IP *.144). All router interfaces bridged.

Browser linux and router linux have correct and stable arps for .143 and .144
```
root@ax1:~# arp | egrep '143|144'
192.168.1.144    0x1         0x2         c4:4f:33:f7:b3:8f     *        br-lan
192.168.1.143    0x1         0x2         24:62:ab:00:83:a7     *        br-lan
```

```
job4:~ > sudo arp -n | egrep '143|144'
192.168.1.143            ether   24:62:ab:00:83:a7   C                     eth0
192.168.1.144            ether   c4:4f:33:f7:b3:8f   C                     eth0
```

Below tcpdump shows browser starts at 19:21:49.122886 to talk to shelly for no obvious reason.
Maybe a javascript bug?

```
19:21:47.087771 IP (tos 0x0, ttl 64, id 32009, offset 0, flags [DF], proto TCP (6), length 358)
    192.168.1.4.55168 > 192.168.1.144.80: Flags [P.], cksum 0xfe56 (correct), seq 1:319, ack 1, win 64240, length 318: HTTP, length: 318
	GET /?m=1[object%20Event] HTTP/1.1
	Host: nous3
	Connection: keep-alive
	User-Agent: Mozilla/5.0 (X11; Linux x86_64) AppleWebKit/537.36 (KHTML, like Gecko) Chrome/101.0.4951.67 Safari/537.36
	Accept: */*
	Referer: http://nous3/?
	Accept-Encoding: gzip, deflate
	Accept-Language: de-DE,de;q=0.9,en-US;q=0.8,en;q=0.7
	
19:21:47.125805 IP (tos 0x0, ttl 255, id 4104, offset 0, flags [none], proto TCP (6), length 40)
    192.168.1.144.80 > 192.168.1.4.55168: Flags [.], cksum 0xf8ab (correct), ack 319, win 5522, length 0
19:21:47.156278 IP (tos 0x0, ttl 255, id 4105, offset 0, flags [none], proto TCP (6), length 271)
    192.168.1.144.80 > 192.168.1.4.55168: Flags [P.], cksum 0x0439 (correct), seq 1:232, ack 319, win 5522, length 231: HTTP, length: 231
	HTTP/1.1 200 OK
	Content-Type: text/html
	Server: Tasmota/12.1.1.4 (ESP8285)
	Cache-Control: no-cache, no-store, must-revalidate
	Pragma: no-cache
	Expires: -1
	Accept-Ranges: none
	Transfer-Encoding: chunked
	Connection: close
	
19:21:47.156548 IP (tos 0x0, ttl 64, id 32010, offset 0, flags [DF], proto TCP (6), length 40)
    192.168.1.4.55168 > 192.168.1.144.80: Flags [.], cksum 0x134d (correct), ack 232, win 64009, length 0
19:21:47.160905 IP (tos 0x0, ttl 255, id 4106, offset 0, flags [none], proto TCP (6), length 1032)
    192.168.1.144.80 > 192.168.1.4.55168: Flags [P.], cksum 0x8745 (correct), seq 232:1224, ack 319, win 5522, length 992: HTTP
19:21:47.161204 IP (tos 0x0, ttl 64, id 32011, offset 0, flags [DF], proto TCP (6), length 40)
    192.168.1.4.55168 > 192.168.1.144.80: Flags [.], cksum 0x0f6d (correct), ack 1224, win 64009, length 0
19:21:47.161338 IP (tos 0x0, ttl 64, id 32012, offset 0, flags [DF], proto TCP (6), length 40)
    192.168.1.4.55168 > 192.168.1.144.80: Flags [F.], cksum 0x0f6c (correct), seq 319, ack 1224, win 64009, length 0
19:21:47.165921 IP (tos 0x0, ttl 255, id 4107, offset 0, flags [none], proto TCP (6), length 40)
    192.168.1.144.80 > 192.168.1.4.55168: Flags [R.], cksum 0x395b (correct), seq 1224, ack 320, win 53270, length 0
19:21:49.122886 IP (tos 0x0, ttl 64, id 14358, offset 0, flags [DF], proto TCP (6), length 60)
    192.168.1.4.57942 > 192.168.1.143.80: Flags [S], cksum 0x3f0e (correct), seq 689291813, win 64240, options [mss 1460,sackOK,TS val 4013935867 ecr 0,nop,wscale 7], length 0
19:21:49.125100 IP (tos 0x0, ttl 128, id 4900, offset 0, flags [DF], proto TCP (6), length 44)
    192.168.1.143.80 > 192.168.1.4.57942: Flags [S.], cksum 0x0051 (correct), seq 9648644, ack 689291814, win 2920, options [mss 1460], length 0
19:21:49.125373 IP (tos 0x0, ttl 64, id 14359, offset 0, flags [DF], proto TCP (6), length 40)
    192.168.1.4.57942 > 192.168.1.143.80: Flags [.], cksum 0x2885 (correct), ack 1, win 64240, length 0
19:21:49.125476 IP (tos 0x0, ttl 64, id 14360, offset 0, flags [DF], proto TCP (6), length 394)
    192.168.1.4.57942 > 192.168.1.143.80: Flags [P.], cksum 0x1439 (correct), seq 1:355, ack 1, win 64240, length 354: HTTP, length: 354
	GET /status HTTP/1.1
	Host: 192.168.1.143
	Connection: keep-alive
	Accept: */*
	User-Agent: Mozilla/5.0 (X11; Linux x86_64) AppleWebKit/537.36 (KHTML, like Gecko) Chrome/101.0.4951.67 Safari/537.36
	X-Requested-With: XMLHttpRequest
	Referer: http://192.168.1.143/?
	Accept-Encoding: gzip, deflate
	Accept-Language: de-DE,de;q=0.9,en-US;q=0.8,en;q=0.7
	
19:21:49.159702 IP (tos 0x0, ttl 128, id 4901, offset 0, flags [DF], proto TCP (6), length 1363)
    192.168.1.143.80 > 192.168.1.4.57942: Flags [FP.], cksum 0xcc81 (correct), seq 1:1324, ack 355, win 2566, length 1323: HTTP, length: 1323
	HTTP/1.1 200 OK
	Server: Mongoose/6.18
	Connection: close
	Content-Type: application/json
	Content-Length: 1208
	
	{"wifi_sta":{"connected":true,"ssid":"job.iot.ssid","ip":"192.168.1.143","rssi":-79},"cloud":{"enabled":false,"connected":false},"mqtt":{"connected":true},"time":"19:21","unixtime":1664904109,"serial":3,"has_update":true,"mac":"2462AB0083A7","cfg_changed_cnt":0,"actions_stats":{"skipped":0},"rollers":[{"state":"stop","source":"input","power":0.00,"is_valid":true,"safety_switch":false,"overtemperature":false,"stop_reason":"normal","last_direction":"open","current_pos":100,"calibrating":false,"positioning":true}],"meters":[{"power":0.00,"overpower":0.00,"is_valid":true,"timestamp":1664911309,"counters":[0.000, 0.000, 0.000],"total":0},{"power":0.00,"overpower":0.00,"is_valid":true,"timestamp":1664911309,"counters":[0.000, 0.000, 0.000],"total":0}],"inputs":[{"input":0,"event":"","event_cnt":0},{"input":0,"event":"","event_cnt":0}],"temperature":50.40,"overtemperature":false,"tmp":{"tC":50.40,"tF":122.73, "is_valid":true},"temperature_status":"Normal","update":{"status":"pending","has_update":true,"new_version":"20220809-123456/v1.12-g99f7e0b","old_version":"20220209-093016/v1.11.8-g8c7bb8d"},"ram_total":49920,"ram_free":36060,"fs_size":233681,"fs_free":144576,"voltage":231.22,"uptime":12124} [|http]

```

**Reply by barbudor** [reply]
Does the problem happens if you open the nous by it's address instead of of name?
If no, I would suspect a name resolution problem in your network. If tasmota web send the request to '.143' while trying to reach 'nous3' it is most likely because someone else told tasmota that nous3=.143

**Comment by joba-1** [comment]
Good question. It does not happen when browsing http://192.168.1.144. Some issue during resolving is at work.

But I was busy in the meantime:

Chromium on linux (Leap 15.3) Version 105.0.5195.127 (openSUSE Build) stable (64-Bit) seems to be the only affected browser.
**Firefox on same linux server**, firefox, chrome and safari on ios, chrome and edge on windows and firefox and chrome on android don't have the problem. Lucky me... 

Could still be tasmota using some problematic javascript code, but much more likely it is just a chrome javascript engine bug. I'll leave it at that for now. Thanks!

For completeness I'll try reset 1, but later. Time's up for today :)

**Reply by joba-1** [reply]
* Changed dhcp shelly ip but the bug follows it. 
* Did reset 1 and a power cycle and manual reconfig (not backup restore) still the web update somehow finds the shelly.
* Changed dhcp tasmota ip but the bug still finds the shelly. 
* Use yet another ip (static) for tasmota ip/gw/sub/dns and restart 1: shelly found
* query dns name of shelly and tasmota (with dig on browser pc): gets correct ip
* query dns ip (with dig -x on browser pc) for both gives correct names
* pings on browser use the correct ip for the names (not a surprise after seeing tcpdump above, but hey, running out of ideas :) )

**Reply by joba-1** [reply]
Needed to restore config from backup to get calibration back. Worked, but energy total is still gone. Normal?

**Reply by barbudor** [reply]
I think energy totals needs to be re-inserted manually

So you still have the problem as soon as you open the device name in the browser and not the ip ?
You may be able to "debug" what happens in the JS using Chrome Dev Tools
But if this happens only on Chrome in Linux and nowhere else, I have no idea neither except that it is unlikely to be in Tasmota

**Reply by joba-1** [reply]
Yes, still have the problem. And thanks for the hint. Already used dev tools today with no conclusion (but then, I don't really know javascript...)

For the curious, this seems to be the code, and it uses this URL: `'.?m=1'+a`. No idea what dot as an URL means in that context.
I agree it is not a tasmota problem, given that any other browser can interpret the dot just fine... Let's leave it at that.

```js
var x=null,lt,to,tp,pc='';
eb=s=>document.getElementById(s);
qs=s=>document.querySelector(s);
sp=i=>eb(i).type=(eb(i).type==='text' ? 'password' : 'text');
wl=f=>window.addEventListener('load',f);
var ft;
function la(p){
    a=p||'';
    clearTimeout(ft);
    clearTimeout(lt);
    if(x!=null){x.abort()}
    x=new XMLHttpRequest();
    x.onreadystatechange=()=>{
        if(x.readyState==4 && x.status==200){
            var s=x.responseText
                .replace(/{t}/g,"<table style='width:100%'>")
                .replace(/{s}/g,"<tr><th>")
                .replace(/{m}/g,"</th><td style='width:20px;white-space:nowrap'>")
                .replace(/{e}/g,"</td></tr>");
            eb('l1').innerHTML=s;
            clearTimeout(ft);
            clearTimeout(lt);
            lt=setTimeout(la,2345);
        }
    };
    x.open('GET', '.?m=1'+a, true);
    x.send();
    ft=setTimeout(la,2e4);
}
function lc(v,i,p){
    if(eb('s')){
        if(v=='h'||v=='d'){
            var sl=eb('sl4').value;
            eb('s').style.background='linear-gradient(to right,rgb('+sl+'%,'+sl+'%,'+sl+'%),hsl('+eb('sl2').value+',100%,50%))';
        }
    }
    la('&'+v+i+'='+p);
}
wl(la);
function jd(){
    var t=0,i=document.querySelectorAll('input,button,textarea,select');
    while(i.length>=t){
        if(i[t]){
            i[t]['name']=(i[t].hasAttribute('id') && (!i[t].hasAttribute('name'))) ? i[t]['id'] : i[t]['name'];
        }
        t++;
    }
}
function sf(s){
    var t=0,i=document.querySelectorAll('.hf');
    while(i.length>=t){
        if(i[t]){
            i[t].style.display=s ? 'block' : 'none';
        }
        t++;
    }
}
wl(jd);
```
